{
  "id": "scientism-faith-in-science-objection",
  "kind": "OBJECTS",
  "position": {
    "axisId": "SCIENCE_PLACE",
    "poleId": "SCIENTISM"
  },
  "name": {
    "fr": "Croire la science sur parole",
    "en": "Taking science on trust"
  },
  "attacks": "POSITION",
  "claim": {
    "fr": "Le scientisme fait de la science la seule autorité légitime ; mais pour la plupart d'entre nous, la croire, c'est la croire sur parole, et la frontière entre esprit scientifique et crédulité passe alors moins entre les savoirs qu'entre les manières de croire.",
    "en": "Scientism makes science the only legitimate authority; but for most of us, believing it means taking it on trust, and the line between a scientific mind and credulity then runs less between kinds of knowledge than between ways of believing."
  },
  "summary": {
    "fr": "La plupart de ceux qui « croient en la science » la croient sur parole, comme d'autres croient leur horoscope ; et en prétendant que tout ce qui compte relève d'elle, le scientisme abandonne le sens et le soin à ceux qui prétendent y répondre.",
    "en": "Most people who \"believe in science\" take it on trust, as others trust their horoscope; and by claiming that everything that matters falls under science, scientism abandons meaning and care to those who claim to provide them."
  },
  "development": [
    {
      "fr": "Le scientisme fait de la science la mesure de tout savoir : ce qu'elle n'établit pas ne vaut que comme opinion.",
      "en": "Scientism makes science the measure of all knowledge: what it does not establish counts only as opinion."
    },
    {
      "fr": "Or, parmi ceux qui « croient en la science », qui saurait dire comment on sait que les continents dérivent, ou qu'un vaccin protège ? Se fier aux experts peut être parfaitement justifié ; mais quand cette confiance devient aveugle, on tient ces vérités comme d'autres tiennent leur horoscope : parce qu'on les a reçues d'une autorité qu'on respecte. Une croyance vraie reçue sans raisons n'est pas encore un esprit scientifique.",
      "en": "Yet among those who \"believe in science\", who could say how we know that continents drift, or that a vaccine protects? Relying on experts can be perfectly justified; but when that trust becomes blind, we hold these truths as others hold their horoscope: because we received them from an authority we respect. A true belief received without reasons is not yet a scientific mind."
    },
    {
      "fr": "Et quand le scientisme prétend que tout ce qui compte relève de la science, il abandonne le sens, le soin, l'expérience vécue à ceux qui prétendent y répondre : les marchands d'énergies prospèrent peut-être sur le terrain qu'il a déserté.",
      "en": "And when scientism claims that everything that matters falls under science, it abandons meaning, care and lived experience to those who claim to provide them: the peddlers of energy healing may well thrive on the ground it has deserted."
    }
  ],
  "conclusion": {
    "fr": "Donc le scientisme ne protège pas de la pensée magique : il en reproduit la forme, une foi en une autorité, et lui laisse le champ libre là où il se tait.",
    "en": "So scientism does not protect against magical thinking: it reproduces its form, faith in an authority, and gives it free rein wherever it falls silent."
  },
  "difficulty": 1,
  "responses": [
    {
      "id": "revise",
      "label": {
        "fr": "C'est juste : ce qui compte n'est pas de croire la science, mais de comprendre comment elle sait, et ce qu'elle ne prétend pas savoir.",
        "en": "Fair enough: what matters is not believing science, but understanding how it knows, and what it does not claim to know."
      },
      "hints": [
        {
          "axisId": "SCIENCE_PLACE",
          "value": {
            "kind": "scalar",
            "value": 0
          },
          "weight": 1
        }
      ],
      "discussion": {
        "fr": "Vous rejoignez le rationalisme critique : la science vaut par sa méthode, non par une autorité qu'on lui prêterait sur tout.",
        "en": "You join critical rationalism: science is valuable for its method, not for an authority one would grant it over everything."
      }
    },
    {
      "id": "qualify",
      "label": {
        "fr": "La foi en la science n'est pas la science ; mais la science reste le savoir qui se soumet le plus systématiquement aux faits, même si beaucoup la croient sans la comprendre.",
        "en": "Faith in science is not science; but science remains the knowledge that submits most systematically to the facts, even if many believe it without understanding it."
      },
      "hints": [
        {
          "axisId": "SCIENCE_PLACE",
          "value": {
            "kind": "scalar",
            "value": -0.6
          },
          "weight": 1
        }
      ],
      "discussion": {
        "fr": "Vous distinguez la science de la façon dont on la croit : le défaut est chez le croyant, non dans le savoir.",
        "en": "You distinguish science from the way people believe it: the flaw lies with the believer, not with the knowledge."
      }
    },
    {
      "id": "refute",
      "label": {
        "fr": "Croire les scientifiques n'est pas croire un astrologue : leur autorité repose sur une méthode éprouvée, que d'autres contrôlent. Faire confiance à bon droit n'est pas de la crédulité.",
        "en": "Believing scientists is not believing an astrologer: their authority rests on a proven method that others check. Trusting with good reason is not credulity."
      },
      "hints": [
        {
          "axisId": "SCIENCE_PLACE",
          "value": {
            "kind": "scalar",
            "value": -1
          },
          "weight": 0.5
        }
      ],
      "discussion": {
        "fr": "Vous tenez que la confiance dans la science est justifiée, même sans en refaire les preuves : c'est la différence entre une autorité contrôlée et une autorité prétendue.",
        "en": "You hold that trust in science is justified even without redoing its proofs: the difference between an authority that is checked and one that is merely claimed."
      }
    }
  ],
  "targets": [
    "scientism-self-correction"
  ],
  "problems": [
    "what-makes-it-science"
  ],
  "updatedAt": "2026-10-29T00:00:00.000Z"
}
